{
  "id": "cal:_elp6sejddtnn6ej3c5m6arj4c5p5upbmcln78ejjdtqn4or55lhmgpb3dcmnirrlehqm4p9dedsn6t35dkpg",
  "source_type": "google_calendar",
  "retrieved_at": "2026-03-23T02:26:12.558762+00:00",
  "summary": "MoOS Media Channel: Review YouTube Source",
  "description": "Curation check for: 'System 3 AI: No Humans Needed'\nURL: https://www.youtube.com/watch?v=K4yLplNrY24",
  "location": "",
  "start_time": "2026-03-23T20:00:00+01:00",
  "end_time": "2026-03-23T21:00:00+01:00",
  "status": "confirmed",
  "organizer": "maassenhochrath@gmail.com",
  "attendees": []
}