{
  "id": "cal:8midlkuogru9jpngfsel9tgbjg",
  "source_type": "google_calendar",
  "retrieved_at": "2026-03-23T02:26:12.558762+00:00",
  "summary": "\ud83c\udfc6 Hackathon \u2014 mo:os MVP Demo",
  "description": "April 19 hackathon.\nTarget: mo:os MVP demonstration.\nAfter this: campaign launch \u2014 TikTok, YouTube, Instagram with Moos as narrator.\n\nMoos would say: 'If it compiles, ship it. If it doesn't, blame the industry.'",
  "location": "",
  "start_time": "2026-04-19",
  "end_time": "2026-04-20",
  "status": "confirmed",
  "organizer": "maassenhochrath@gmail.com",
  "attendees": []
}