{
  "id": "cal:6hhm6cpgc8qjgbb360s68b9k65ijgbb26gojibb1cdij2e1m6srj0d9jc8",
  "source_type": "google_calendar",
  "retrieved_at": "2026-03-23T02:26:12.558762+00:00",
  "summary": "PRG 001",
  "description": "000\n034\n035\n036\n037\n038\n...",
  "location": "",
  "start_time": "2026-03-24T04:00:00+01:00",
  "end_time": "2026-03-24T05:00:00+01:00",
  "status": "confirmed",
  "organizer": "maassenhochrath@gmail.com",
  "attendees": []
}