{
  "id": "cal:mdu0epbb0or30o9noqaehsrffu_20260529T000000Z",
  "source_type": "google_calendar",
  "retrieved_at": "2026-03-23T02:26:12.558762+00:00",
  "summary": "### GT TIJDLIJN 2024-2025 Entree 11.07 11.07",
  "description": "<b>2025: Tijdlijn tbv rechtszaak gemeente met: Entree, sollicitaties, financi\u00ebn, huur, SHV, doktersafspraken, communicatie email, WA met Geurt. Zorgen dat alles zwart op wit staat voor bewijsvoering</b><br><b><u><br><br></u></b><br><b><u><br></u></b><br><b><u>2024</u></b><br>28.10: terugbelverzoek gedaan aan Utkun inzake uitstel stukken (11.11.2024) en voorschot. Heeft misschien teruggebeld.<br>29.10: C. Utkun gesproken/ Voort het voorschot moet alles behalve jaarstukken/aangifte.<br>06.11: C. Utkun even bellen, kijken naar de stukken. HC ontbreekt. Geen toelichting levensonderhoud, zie bericht via MijnArnhem. Geen schulden (zie bericht, behalve VerderGroep), Geen bezittingen (zie bericht)<br>06.11 Email inzake samenwonen en email inzake meettijd Sam ANTW?<br>14.11 Marilyn was ziek, die bellen we zodra alles is verstuurd aan GA (gemeente): HC, brief Lev Afschriften betaald en Daphne email gestuurd (zij is 18.11 OK)<br>29.11: Afspraak Marylin/Verder ivm arbeidsovereenkomst (app gestuurd). HC, Bijstand verder, brief Sam/Rick bij Geurt maken. Uiterlijk maandag 2 completeren. Entree.<br>16.12: Bezwaar gemaakt op beslissing Utkun. Termijn antwoord in de gaten houden, 6 weken na ontvangst op 20.12 = 31.12\u00a0<br>16.12:\u00a0Portaal geantwoord op haar email van 13.11 met vraag naar stavaza Meettijd. Daarna pas formulier samenvoegen indienen.<br>17.12 Energiecontract oversluiten of 24.12 350 borg betalen. Energiedirect tm dec2024 voldaan<br>17.12: Ultimatum Marilyn anders nieuwe coach!<br>19.12:\u00a0\u00a0Alpina betalen voor 01-01<br>23.12: Aanmelden SHV via Gemeente\u00a0 ipv Coach. Energiedirect Alpina en overigen betalen achterstand |(chatafspraak Kelvin v\u00f3\u00f3r 24e): Entree Geurt weer 20e en email inzake meettijd SM en samenvoegen.<br>Brief bezwaar aantekeken. Opruimen voor VVE en deurwaarders met beslagen. Pension Zonne.<br>--------------------------<br>Marilyn: 0610-556655 en\u00a0<a href=\"mailto:Marilyn.van.ussen@wijkteams.arnhem.nl\" target=\"_blank\">Marilyn.van.ussen@wijkteams.arnhem.nl</a> (mailto:<a href=\"mailto:Marilyn.van.ussen@wijkteams.arnhem.nl\" target=\"_blank\">Marilyn.van.ussen@wijkteams.arnhem.nl</a>)\u00a0(mailto:<a href=\"mailto:Marilyn.van.ussen@wijkteams.arnhem.nl\" target=\"_blank\">Marilyn.van.ussen@wijkteams.arnhem.nl</a> (mailto:<a href=\"mailto:Marilyn.van.ussen@wijkteams.arnhem.nl\" target=\"_blank\">Marilyn.van.ussen@wijkteams.arnhem.nl</a>))<br>Gemeente Arnhem, uitkering: voorschot aanvragen via: Dhr De Hoog, Marieke 0631114942, Dhr C.Utkun (behandelaar)",
  "location": "",
  "start_time": "2026-05-29T02:00:00+02:00",
  "end_time": "2026-05-29T04:00:00+02:00",
  "status": "confirmed",
  "organizer": "maassenhochrath@gmail.com",
  "attendees": []
}