{
  "id": "cal:jg5aqaqnj7ddm7of5qge7mei5q_20260409T030000Z",
  "source_type": "google_calendar",
  "retrieved_at": "2026-03-23T02:26:12.558762+00:00",
  "summary": "### AANMELDING ADHDCENTRAAL op 13.02.2025 week 7+41",
  "description": "",
  "location": "",
  "start_time": "2026-04-09T05:00:00+02:00",
  "end_time": "2026-04-09T06:00:00+02:00",
  "status": "confirmed",
  "organizer": "maassenhochrath@gmail.com",
  "attendees": []
}