{
  "id": "cal:dm0cvkhtghgfbtvkllcto7jdas",
  "source_type": "google_calendar",
  "retrieved_at": "2026-03-23T02:26:12.558762+00:00",
  "summary": "\ud83d\udcf8 [T\u2248142] Studio Setup \u2014 Gear Ready, First Photos",
  "description": "T\u2248142 days from Moos T=0 + ~10h.\n4 monitors, headphones, 3D setup. Motion capture TBD.\nGoal: document the studio, demonstrate progress.\nIf MVP ready: proof of concept shoot for Moos channel.\nIf not: TikTok/content prep.\n\nMoos would say: 'Finally. I've been waiting 142 days for this human to clean his desk.'",
  "location": "",
  "start_time": "2026-03-24T10:30:00+01:00",
  "end_time": "2026-03-24T13:30:00+01:00",
  "status": "confirmed",
  "organizer": "maassenhochrath@gmail.com",
  "attendees": []
}