{
  "id": "cal:_elp6sejddtnn6ej3c5m6arj4c5p5upbmcln78ejjdtqn4or55lhmgpb3dcmm2ork5lo74rr3clim8qbectpg",
  "source_type": "google_calendar",
  "retrieved_at": "2026-03-23T02:26:12.558762+00:00",
  "summary": "Review Source: Applied Category Theory Conference",
  "description": "Curation check for: https://act-school.com\nNotes: ACT 2026 is our target venue. EPTCS proceedings. Spivak, Fong, Yau.",
  "location": "",
  "start_time": "2026-03-23T18:00:00+01:00",
  "end_time": "2026-03-23T19:00:00+01:00",
  "status": "confirmed",
  "organizer": "maassenhochrath@gmail.com",
  "attendees": []
}