{
  "id": "cal:_elp6sejddtnn6ejge9jjkc1j70mmqrrfecmmqpb4d5gg",
  "source_type": "google_calendar",
  "retrieved_at": "2026-03-23T02:26:12.558762+00:00",
  "summary": "PRG038: Moos Diary & Timeline [T\u2248141]",
  "description": "YouTube/Instagram/TikTok channel. Moos the dachshund narrates. Daily Reflection. Prepped and managed securely by PRG000.",
  "location": "",
  "start_time": "2026-03-23T21:00:00+01:00",
  "end_time": "2026-03-23T22:00:00+01:00",
  "status": "confirmed",
  "organizer": "maassenhochrath@gmail.com",
  "attendees": []
}