{
  "id": "cal:5kvan25bk0pog18qhiatd4b1gp_20260530T040000Z",
  "source_type": "google_calendar",
  "retrieved_at": "2026-03-23T02:26:12.558762+00:00",
  "summary": ">>> Termijn ZT. 78 euro pm.",
  "description": "",
  "location": "",
  "start_time": "2026-05-30T06:00:00+02:00",
  "end_time": "2026-05-30T07:00:00+02:00",
  "status": "confirmed",
  "organizer": "maassenhochrath@gmail.com",
  "attendees": []
}