{
  "id": "cal:lmc5odevucfsqi2k61i8adh9ft_20260531T220000Z",
  "source_type": "google_calendar",
  "retrieved_at": "2026-03-23T02:26:12.558762+00:00",
  "summary": "###   MAKEL",
  "description": "MAKEL\nEducatie en representatie. Businessontwikkeling acquisitie en netwerken\nChecklist:\nVoortgang:\n25.11 cursusmateriaal via marktplaats. Hoe gaan we de klant tegemoet treden?\n\n0..\u00a0Anja en..\n1. IB met gezin: status actief/dagelijk \nVoortgang:\nIB+gezin\u00a0van 5 totaal woning Arnhem. Opdracht 8 november 2024\n15.11 Hypotheek via Moninca (zie email IB 15 nov 2024)\n16.12: IB aanbod Arnhem doorgegeven per email, reactie ?\n18.12: IB aanbod Arnhem doorgegeven per email, reactie ?\n30.12: wenskaart 2025\n02.01: uitnodiging diner per email gestuurd\n2. De heer Mehmet: status actief/even afw\nVoortgang:\nOpdracht\u00a08 november 2024\n15.11 Mehmet moet IB gegevens zakenrelaties en hemzelf geven en is op 23.11 in NL\n28.11\u00a0Mehmet en IB gesproken. Huurhuis voor gezin (V, k3, z17) in Ede. Ook vermogende cli\u00ebnt 0 uit Izmir voor beleggingen (Kanat Boya Verf, Mesut?).\u00a0opdracht mondeling gekregen. Afspraak gemaakt regelmatig op de hoogte te houden. Rest volgt..\n04.12 musis IB dossier verhuurder van advcaat of bankrelatie of accountant\n16.12: IB gemaild met lijst gegevens en aanbod voor Mehmet, reactie ?\n19.12: Aanbodmail week 51 aan IB gezonden. IB heeft geen email/nr van hem dus wacht op zijn bericht\n\n3. Zaak Dhr Mesut /\u00a0 Kanat Boya Verf\nVoortgang:\n06.12 start\n09.12\u00a0IB afspraak maken zaak Mesut zorginstelling, niet gebeurd.. Fijne en laagdrempelige Generatiehuizen. Vroegere instroom, betere mantelzorg voor kinderen. Vermogens en huizen verschuiving. Dit plan bespreken met IB op een gunstig moment. Voordelen: ideale woonhuis voor oudere die fijn en vertrouwd wil wonen geheel naar de eisen van deze tijd en gericht op doelgroepen. Tevens investering doorzelfde doelgroep en op maat gesneden investeringsmogelijkheden zoals lokale participatie op tehuisniveau, belegging in NV als geheel. Collaboratie met lokale bedrijven zoals AS-zorg inzake exploitatie\n30.12 IB bellen aanbodmail, zie app",
  "location": "",
  "start_time": "2026-06-01T00:00:00+02:00",
  "end_time": "2026-06-01T02:00:00+02:00",
  "status": "confirmed",
  "organizer": "maassenhochrath@gmail.com",
  "attendees": []
}