{
  "id": "cal:24rb3gmd16fkvskbgnail4d8pv_20260602T220000Z",
  "source_type": "google_calendar",
  "retrieved_at": "2026-03-23T02:26:12.558762+00:00",
  "summary": "###   MOEDERDAG",
  "description": "Nog betalen 62,50 aan Ruth min laartje azy, rest 30 eur plus 43,50 trein naar reich\n\n1. Rijnkade masterplan/ RAARB \nHuur Vic: Entree inschrijving wijzigen met brp adreshistorie via\u00a0arnhem.nl (http://arnhem.nl) (http://arnhem.nl)\u00a0(http://arnhem.nl) (http://arnhem.nl) (http://arnhem.nl) (http://arnhem.nl), zoek BRP, kies\u00a0uittreksel registratie en dan paarse knop\n\n01.01.2025 Trapleuning bg naar 1e, kelder Zwam leeg\n19.04.2025 Dak en scheuren laten bekijken door Ruud: Afspraak maken. Quickscan aangevraagd voor onderzoek funderingsproblemen/scheurvorming. Email gestuurd naar TP voor dekking reparatie scheuren. Nadeelcompensatie aangevraagd email waterschap. Dinsdag 22.04 Paul Hardeman bellen\n22.04 Paul Hardeman bellen en voor het fietsanker Cees weer bellen, hoes bestellen\n\n--------------------------------------------------------------------------------------------\n2. Apple Iphone Ipad ICloud Lacie en die andere HD recoveren Foto's etc.\u00a0\nIphone foto's nu niet meer op iphone. 53,85 gb beschikbaar. Foto's geheugen nog maar 616mb. Whatsapp neemt echter 34,54 gb in. Backup hiervan maken/opschonen. Alle gemaakte foto's komen in cloud maar bv geen binnenkomende appfotosvideos\n\nGecrasht HD oude pc. Gecrashte Seagate HD. Tasje USB stick mama. Oude videocameras met videobandjes/MD's. Dvd's met opnames, VHS cassettes, whatsappberichten en social media video bestanden en foto's etc.\n\n17.12.2024: Alle foto's iphone in de cloud gezet. Lacie back-uppen van laatste datum tot en met 17.12.2024. Alles overgezet op lacie en geen schifting/prullenbak/lacie/icloud gemaakt. \n19.12.2024 Nu foto;s in cloud ordenen in albums en eventueel foto's verwijderen. Gedaan\u00a0\n2024-11decnovseptaug... en dan terug in de tijd. tot 2022.\u00a0Opslaan in map jaar/maand.\n20.12.2024: 1. BackupLacie 2024-2022:\u00a0Gedaan 2024-11dec(laatste filmpje tunesie)-heel aug.\u00a0\n\n20.12.2024: Google foto's van mama (mijn oude googlefoto's 2018-2020, deel zonder datum) op mijn pc map Google fotos gezet en aan het archiveren: schiften wat wegkan, rest archiveren (Met namen album icoud ipv map met maand/jaar ) in pc map. Dan\u00a0albumfoto's naar icloud mama.\n20.12.2024: 2. Map Google fotos op PC gedaan: Archivering van 06.02.2018 tot 01.06.2024 (NSJ). Laatste Cloudtoevoeging: 20.12.2024, foto\u2019s mama Luna periode 20.12.2024. BackupLacie pas als de map klaar is en dan met albumnamen ipv map jaar/maand.\u00a0\n01.01.2025: Laatste Cloudtoevoeging op 01.01.2025 van nieuw gevonden foto\u2019s op laptop mama, foto\u2019s van o.o. papa. Deze mappen op desktop nog op Lacie zetten met albumnamen ipv map jaar/maand.\n03.01.2025: Laatste cloudtoevoeging van nieuw gevonden whatsappbestanden periode feb2022 (?) naar album jammen aan de kade. Moet nog op Lacie, met albumnamen staat op desktop mijn laptop\n------------------------------------------------------------------------------------\n4. Schuld aan mama\u00a0\n\nTotaal: -\u20ac 5.503,5\n\nDan terugbetaald: \n21.10 \u20ac 170,00 (spullen voor ma gekocht minus kaartje Derek)\n05.11 250 via ING van spaarrek\n23.11 400 via ING na uitbet loon\n26.11 kaartje Bryan Adams 100 euro betaald\nDec: Huur 825-625 voldaan dus: \u20ac 200,-- eraf. \nJan: \u20ac 200,--\nFeb: \u20ac 0,--. 1 termijn 01.03 was eigenlijk feb en is nu bij maart.\nMaart \u20ac 200,-\nApril-juli \u20ac800,-\naug: \u20ac 200,- + extra \u20ac 325,-- (totaal met huur 1150 nog even checken, zie boven vetgedrukt)\nNov: 500 extra\nDec: \u20ac 500 extra\njan 2024 \u20ac 400\u00a0\nfeb 2024: \u20ac200 (825 overgemaakt ivm wsnp), rest contant (niet gebeurd)\n1 maart 2024: \u20ac 200\n29 maart 2024:\u00a0300 extra =\u00a0\u20ac 825,- ing (02.04) en \u20ac 235(leen) + \u20ac 100,- abn\n26 april 2024 (huur mei): pauze tm juli (vervalt..besloten 02.12): \u20ac 200,--\u00a0\n25 juni 2024 (huur juni):\u00a0\u00a0\u20ac 200,-\n28 augustus 2024 (huur juli):\u00a0\u00a0\u20ac 200,- (AUG MET SKIP DEELS)\n4 oktober 2024 (sept):\u00a0\u20ac 200,-\n6 november 2024 (huur okt):\u00a0\u20ac 200,-\n9 december 2024 (huur nov): \u20ac 200,-\n9 januari huur december 2024 : \u20ac 200,--\nfebruari huur jan 2025: Alleen 100 betaald op 20 maart en niks ingelopen\nmaart huur feb en 200 ingelopen\napril huur maart en 200 ingelopen\nMei huur april en 200 ingelopen\n---------------------------------\nJuni huur mei+200\nJuli huur juni+200\nnog huur juli+225 (dan ben ik bij tm juli! en resteert alleen de schuld, zie onder)\nnog huur aug+200 (af van schuld \u20ac 808,00)\nnog huur sept+200\u00a0 (af van schuld \u20ac 808,00)\n----------------\nTotaal +7.345,00\n\n-Diversen 125,00\n- \u20ac 1250,-- (van 2023) en\n-\u20ac 350 aug 2024 (deels met SKIP betaald)\n1.725,00\n\n5503+1725-7345=117 plus minus 225 huur feb \nplus 150 diverse is 258 schuld nog per 10.07 en juli betaald.",
  "location": "",
  "start_time": "2026-06-03T00:00:00+02:00",
  "end_time": "2026-06-03T02:00:00+02:00",
  "status": "confirmed",
  "organizer": "maassenhochrath@gmail.com",
  "attendees": []
}