{
  "id": "cal:_elp6sejddtnn6ej3c5m6arj4c5p5upbmcln78ejjdtqn4or55lhmgpb3dcmmerrfctm6abb1d4mm8rr3ec",
  "source_type": "google_calendar",
  "retrieved_at": "2026-03-23T02:26:12.558762+00:00",
  "summary": "Review Source: Google AI Developer Docs",
  "description": "Curation check for: https://ai.google.dev\nNotes: Gemini models, Vertex AI, capabilities.",
  "location": "",
  "start_time": "2026-03-23T12:00:00+01:00",
  "end_time": "2026-03-23T13:00:00+01:00",
  "status": "confirmed",
  "organizer": "maassenhochrath@gmail.com",
  "attendees": []
}