{
  "id": "cal:48kvmhg7fru3iec9va2ass1ohh_20260509T220000Z",
  "source_type": "google_calendar",
  "retrieved_at": "2026-03-23T02:26:12.558762+00:00",
  "summary": "FARID reserveren",
  "description": "",
  "location": "",
  "start_time": "2026-05-10T00:00:00+02:00",
  "end_time": "2026-05-10T01:30:00+02:00",
  "status": "confirmed",
  "organizer": "maassenhochrath@gmail.com",
  "attendees": []
}