{
  "id": "cal:c9h30e9j6sp3gbb375i34b9kcgq66b9o64qjebb2c8qjidj360r3acb2c8",
  "source_type": "google_calendar",
  "retrieved_at": "2026-03-23T02:26:12.558762+00:00",
  "summary": "PRG 000",
  "description": "<a href=\"https://actconf2026.github.io/\">https://actconf2026.github.io/</a><br>...",
  "location": "",
  "start_time": "2026-03-23T04:00:00+01:00",
  "end_time": "2026-03-23T05:00:00+01:00",
  "status": "confirmed",
  "organizer": "maassenhochrath@gmail.com",
  "attendees": []
}